{
  "$ref": "#/definitions/promotions",
  "definitions": {
    "promotions": {
      "type": "object",
      "properties": {
        "id": {
          "type": "string"
        },
        "title": {
          "type": "string"
        },
        "subtitle": {
          "type": "string"
        },
        "description": {
          "type": "string"
        },
        "imageUrl": {
          "type": "string"
        },
        "ctaText": {
          "type": "string"
        },
        "ctaLink": {
          "type": "string"
        },
        "badgeText": {
          "type": "string"
        },
        "badgeColor": {
          "type": "string",
          "enum": [
            "red",
            "blue",
            "green",
            "yellow",
            "primary"
          ],
          "default": "primary"
        },
        "isActive": {
          "type": "boolean",
          "default": true
        },
        "displayOrder": {
          "type": "number",
          "default": 0
        },
        "$schema": {
          "type": "string"
        }
      },
      "required": [
        "id",
        "title",
        "imageUrl"
      ],
      "additionalProperties": false
    }
  },
  "$schema": "http://json-schema.org/draft-07/schema#"
}