{
  "id": "promotion-xe-cau-soosan",
  "title": "Xe Cẩu Soosan",
  "subtitle": "Chất Lượng Hàn Quốc - Giá Cạnh Tranh",
  "description": "Xe cẩu từ 3-15 tấn, công nghệ tiên tiến. Bảo hành 2 năm hoặc 2000 giờ làm việc",
  "imageUrl": "https://images.pexels.com/photos/1267338/pexels-photo-1267338.jpeg?auto=compress&cs=tinysrgb&w=1920",
  "ctaText": "Tìm hiểu thêm",
  "ctaLink": "/danh-muc-xe?type=xe-cau",
  "badgeText": "Nhà sản xuất",
  "badgeColor": "blue",
  "isActive": true,
  "displayOrder": 2
}
