{
  "id": "promotion-xe-dong-lanh",
  "title": "Xe Tải Thùng Đông Lạnh",
  "subtitle": "Giải pháp vận chuyển thực phẩm an toàn",
  "description": "Thùng đông lạnh Carrier, Thermoking. Nhiệt độ từ -18°C đến +15°C. Tiết kiệm nhiên liệu",
  "imageUrl": "https://images.pexels.com/photos/310983/pexels-photo-310983.jpeg?auto=compress&cs=tinysrgb&w=1920",
  "ctaText": "Báo giá ngay",
  "ctaLink": "/lien-he",
  "badgeText": "Mới nhất",
  "badgeColor": "green",
  "isActive": true,
  "displayOrder": 3
}
