{
  "id": "promotion-mooc-giam-gia",
  "title": "Khuyến Mãi Đặc Biệt Tháng 12",
  "subtitle": "Giảm giá lên đến 15% cho Sơ Mi Rơ Mooc",
  "description": "Áp dụng cho tất cả các dòng mooc 3 trục, mooc ben, mooc xitec. Giao xe ngay, hỗ trợ vay 80%",
  "imageUrl": "https://images.pexels.com/photos/1391487/pexels-photo-1391487.jpeg?auto=compress&cs=tinysrgb&w=1920",
  "ctaText": "Xem chi tiết",
  "ctaLink": "/danh-muc-xe?type=mooc",
  "badgeText": "Giảm 15%",
  "badgeColor": "red",
  "isActive": true,
  "displayOrder": 1
}
